{
  "cases": [
    {
      "case_id": "classify-suppress-group-and-countdown",
      "expected": {
        "final_state": {
          "fixed_runs": [],
          "reminders": [
            {
              "fire_at": "2026-08-30T13:00:30+00:00",
              "id": "0000000d-0000-4000-8004-000000000000",
              "kind": "day_of",
              "message_id": "700000000000000002",
              "run_id": "00000006-0000-4000-8004-000000000000",
              "sent_at": "2026-08-31T01:00:30+00:00"
            },
            {
              "fire_at": "2026-08-31T00:30:29+00:00",
              "id": "0000000c-0000-4000-8004-000000000000",
              "kind": "countdown_31",
              "message_id": null,
              "run_id": "00000006-0000-4000-8004-000000000000",
              "sent_at": "2026-08-31T01:00:30+00:00"
            },
            {
              "fire_at": "2026-08-31T00:30:30+00:00",
              "id": "0000000b-0000-4000-8004-000000000000",
              "kind": "countdown_30",
              "message_id": "700000000000000001",
              "run_id": "00000006-0000-4000-8004-000000000000",
              "sent_at": "2026-08-31T01:00:30+00:00"
            },
            {
              "fire_at": "2026-08-31T01:00:00+00:00",
              "id": "00000008-0000-4000-8004-000000000000",
              "kind": "day_of",
              "message_id": "700000000000000003",
              "run_id": "00000002-0000-4000-8004-000000000000",
              "sent_at": "2026-08-31T01:00:30+00:00"
            },
            {
              "fire_at": "2026-08-31T01:00:00+00:00",
              "id": "0000000a-0000-4000-8004-000000000000",
              "kind": "day_of",
              "message_id": null,
              "run_id": "00000004-0000-4000-8004-000000000000",
              "sent_at": "2026-08-31T01:00:30+00:00"
            },
            {
              "fire_at": "2026-08-31T00:59:00+00:00",
              "id": "0000000e-0000-4000-8004-000000000000",
              "kind": "day_off",
              "message_id": null,
              "run_id": "00000001-0000-4000-8004-000000000000",
              "sent_at": "2026-08-31T01:00:30+00:00"
            },
            {
              "fire_at": "2026-08-31T01:00:00+00:00",
              "id": "00000007-0000-4000-8004-000000000000",
              "kind": "day_of",
              "message_id": "700000000000000003",
              "run_id": "00000001-0000-4000-8004-000000000000",
              "sent_at": "2026-08-31T01:00:30+00:00"
            },
            {
              "fire_at": "2026-08-31T01:00:00+00:00",
              "id": "00000009-0000-4000-8004-000000000000",
              "kind": "day_of",
              "message_id": "700000000000000002",
              "run_id": "00000003-0000-4000-8004-000000000000",
              "sent_at": "2026-08-31T01:00:30+00:00"
            },
            {
              "fire_at": "2026-09-01T01:00:00+00:00",
              "id": "0000000f-0000-4000-8004-000000000000",
              "kind": "day_of",
              "message_id": null,
              "run_id": "00000005-0000-4000-8004-000000000000",
              "sent_at": null
            }
          ],
          "rsvps": [
            {
              "at": "2026-08-31T01:00:30+00:00",
              "run_id": "00000006-0000-4000-8004-000000000000",
              "source": "reaction",
              "state": "no",
              "user_id": "1002"
            }
          ],
          "runs": [
            {
              "bosses": [
                "HMaleficStar",
                "HFA"
              ],
              "channel_id": "333",
              "datetime": "2026-08-31T01:30:00+00:00",
              "fixed_run_id": null,
              "id": "00000006-0000-4000-8004-000000000000",
              "participants": [
                "1001",
                "1002",
                "1003"
              ],
              "source": "amend",
              "status": "planned",
              "week_start": "2026-08-26T16:00:00+00:00"
            },
            {
              "bosses": [
                "HMaleficStar",
                "HFA"
              ],
              "channel_id": "222",
              "datetime": "2026-08-31T11:00:00+00:00",
              "fixed_run_id": null,
              "id": "00000002-0000-4000-8004-000000000000",
              "participants": [
                "1002"
              ],
              "source": "amend",
              "status": "planned",
              "week_start": "2026-08-26T16:00:00+00:00"
            },
            {
              "bosses": [
                "HMaleficStar",
                "HFA"
              ],
              "channel_id": "222",
              "datetime": "2026-08-31T12:00:00+00:00",
              "fixed_run_id": null,
              "id": "00000004-0000-4000-8004-000000000000",
              "participants": [
                "1001",
                "1002",
                "1003"
              ],
              "source": "amend",
              "status": "cancelled",
              "week_start": "2026-08-26T16:00:00+00:00"
            },
            {
              "bosses": [
                "HMaleficStar",
                "HFA"
              ],
              "channel_id": "222",
              "datetime": "2026-08-31T13:30:00+00:00",
              "fixed_run_id": null,
              "id": "00000001-0000-4000-8004-000000000000",
              "participants": [
                "1001",
                "1002",
                "1003"
              ],
              "source": "amend",
              "status": "planned",
              "week_start": "2026-08-26T16:00:00+00:00"
            },
            {
              "bosses": [
                "HMaleficStar",
                "HFA"
              ],
              "channel_id": "333",
              "datetime": "2026-08-31T14:00:00+00:00",
              "fixed_run_id": null,
              "id": "00000003-0000-4000-8004-000000000000",
              "participants": [
                "1001",
                "1003"
              ],
              "source": "amend",
              "status": "planned",
              "week_start": "2026-08-26T16:00:00+00:00"
            },
            {
              "bosses": [
                "HMaleficStar",
                "HFA"
              ],
              "channel_id": "222",
              "datetime": "2026-09-01T13:30:00+00:00",
              "fixed_run_id": null,
              "id": "00000005-0000-4000-8004-000000000000",
              "participants": [
                "1001",
                "1002",
                "1003"
              ],
              "source": "amend",
              "status": "planned",
              "week_start": "2026-08-26T16:00:00+00:00"
            }
          ],
          "side_effects": [
            {
              "channel_id": "333",
              "dedupe_scope": "native",
              "effect_kind": "reminder",
              "mention_everyone": false,
              "mentions": [
                "1001"
              ],
              "outcome": "bound",
              "role_mentions": [],
              "targets": [
                {
                  "binding_type": "reminder",
                  "key_primary": "0000000b-0000-4000-8004-000000000000",
                  "key_secondary": null
                }
              ]
            },
            {
              "channel_id": "333",
              "dedupe_scope": "native",
              "effect_kind": "reminder",
              "mention_everyone": false,
              "mentions": [
                "1001",
                "1002"
              ],
              "outcome": "bound",
              "role_mentions": [],
              "targets": [
                {
                  "binding_type": "reminder",
                  "key_primary": "0000000d-0000-4000-8004-000000000000",
                  "key_secondary": null
                },
                {
                  "binding_type": "reminder",
                  "key_primary": "00000009-0000-4000-8004-000000000000",
                  "key_secondary": null
                }
              ]
            },
            {
              "channel_id": "222",
              "dedupe_scope": "native",
              "effect_kind": "reminder",
              "mention_everyone": false,
              "mentions": [
                "1001",
                "1002"
              ],
              "outcome": "bound",
              "role_mentions": [],
              "targets": [
                {
                  "binding_type": "reminder",
                  "key_primary": "00000008-0000-4000-8004-000000000000",
                  "key_secondary": null
                },
                {
                  "binding_type": "reminder",
                  "key_primary": "00000007-0000-4000-8004-000000000000",
                  "key_secondary": null
                }
              ]
            }
          ]
        },
        "steps": [
          {
            "value": "00000001-0000-4000-8004-000000000000"
          },
          {
            "value": "00000002-0000-4000-8004-000000000000"
          },
          {
            "value": "00000003-0000-4000-8004-000000000000"
          },
          {
            "value": "00000004-0000-4000-8004-000000000000"
          },
          {
            "value": "00000005-0000-4000-8004-000000000000"
          },
          {
            "value": "00000006-0000-4000-8004-000000000000"
          },
          {
            "value": "no"
          },
          {
            "value": "00000007-0000-4000-8004-000000000000"
          },
          {
            "value": "00000008-0000-4000-8004-000000000000"
          },
          {
            "value": "00000009-0000-4000-8004-000000000000"
          },
          {
            "value": "0000000a-0000-4000-8004-000000000000"
          },
          {
            "value": "0000000b-0000-4000-8004-000000000000"
          },
          {